{
  "schema_version": "1.0.0",
  "record_type": "worker_authorization",
  "record_status": "draft",
  "authority": "bounded_action_authorization",
  "accepts_adr": false,
  "authorizes_work": false,
  "general_destructive_action_authorized": false,
  "record_id": null,
  "prepared_at": null,
  "prepared_by": null,
  "authorization_kind": null,
  "purpose_statement": null,
  "run_owner": null,
  "git_commit": null,
  "worker_ref": null,
  "requested_action_ids": [],
  "action_scopes": [],
  "intended_data": [],
  "named_test_locations": [],
  "disposable_restore_test_source_copy": null,
  "max_executions": 1,
  "expected_duration_minutes": null,
  "spending_ceiling": null,
  "review_at": null,
  "expires_at": null,
  "teardown_authority": null,
  "recovery_owner": null,
  "restore_gate_evidence_ref": null,
  "permissions": {
    "dataset_download": false,
    "training": false,
    "important_experiment": false,
    "disposable_source_copy_delete": false,
    "worker_lifecycle_change": false,
    "primary_vault_copy_delete": false,
    "independent_backup_copy_delete": false,
    "other_retained_copy_delete": false
  },
  "hard_prohibited_action_ids": [
    "worker_lifecycle_change",
    "primary_vault_copy_delete",
    "independent_backup_copy_delete",
    "other_retained_copy_delete"
  ],
  "owner_approval_required": true,
  "approved_by": null,
  "approved_at": null,
  "approval_statement": null,
  "approval_evidence_ref": null,
  "adr_ref": "docs/adr/0005-artifact-storage.md"
}
